{
  "architecture_decision": "SYSTEM-001-A",
  "cases": [
    {
      "authoring_validation_summary": {
        "coverage": {
          "authored_action_checks": 4,
          "authored_role_checks": 2,
          "differential_cases": 5
        },
        "gameplay_effect": "NONE",
        "public_projection_digest": "7fbc19692070ba03af59baad0a1e576ee9dcc9bfc0b41cacd708b89b59a908ba",
        "reason_code": "AUTHORING_COMPATIBILITY_CONFIRMED",
        "status": "PASS",
        "validation_trace": [
          {
            "code": "SELECTED_PROFILE_MATCHES",
            "status": "PASS",
            "step": "profile_match"
          },
          {
            "code": "AUTHORING_REQUIREMENTS_ACCEPTED",
            "status": "PASS",
            "step": "compatibility"
          }
        ]
      },
      "binding_id": "binding.fingerprint.boot.missing_nvme.system-model.v1",
      "case_id": "proof.case.binding.fingerprint.boot.missing_nvme.system-model.v1",
      "differential_cases": 5,
      "fingerprint_id": "fingerprint.boot.missing_nvme",
      "profile_id": "profile.dell.poweredge-r740xd.hybrid-24x2_5.v1",
      "profile_revision": 1,
      "public_candidate_combinations": 31,
      "public_candidate_count": 5,
      "public_projection_digest": "7fbc19692070ba03af59baad0a1e576ee9dcc9bfc0b41cacd708b89b59a908ba",
      "public_projection_path": "docs/system-models/task-052/public-projections/binding-fingerprint-boot-missing_nvme-system-model-v1.json",
      "rationale_graph_count": 41,
      "resolver_key": "resolver.fingerprint.boot.missing_nvme.v1",
      "semantic_model_digest": "91565211561d2fea86679310b96825854b87eb1ac45e0ff47e45a6f935a39b01",
      "source_review": [
        {
          "access_status": "accessible",
          "product_scope": "iDRAC9 with Lifecycle Controller, including PowerEdge R740xd",
          "publisher": "Dell Technologies",
          "revision": "iDRAC9 6.xx Lifecycle Controller User's Guide",
          "source_id": "src.dell.idrac9.lifecycle-introduction",
          "title": "Lifecycle Controller introduction",
          "url": "https://www.dell.com/support/manuals/en-us/poweredge-r740xd/idrac9_6.xx_lc_ug/introduction",
          "used_claim_ids": [
            "claim.idrac9.out-of-band-management"
          ]
        },
        {
          "access_status": "accessible",
          "product_scope": "PowerEdge R740xd backplane options",
          "publisher": "Dell Technologies",
          "revision": "Online service-manual topic; topic revision not exposed",
          "source_id": "src.dell.r740xd.backplane-details",
          "title": "PowerEdge R740xd backplane details",
          "url": "https://www.dell.com/support/manuals/en-us/poweredge-r740xd/per740xd_ism_pub/backplane-details?guid=guid-5d119b25-5363-4be0-b451-e30ae7ca3f5b&lang=en-us",
          "used_claim_ids": [
            "claim.r740xd.hybrid-backplane",
            "claim.r740xd.twenty-sas-four-nvme-option"
          ]
        },
        {
          "access_status": "accessible",
          "product_scope": "PowerEdge R740xd 24-by-2.5-inch NVMe/hybrid routing",
          "publisher": "Dell Technologies",
          "revision": "Online service-manual topic; Figure 16; topic revision not exposed",
          "source_id": "src.dell.r740xd.cable-routing",
          "title": "PowerEdge R740xd cable routing",
          "url": "https://www.dell.com/support/manuals/en-us/poweredge-r740xd/per740xd_ism_pub/cable-routing?guid=guid-06637506-d7db-43e6-9c15-be4a832d4fbe",
          "used_claim_ids": [
            "claim.r740xd.sas-perc-path",
            "claim.r740xd.pcie-nvme-path"
          ]
        },
        {
          "access_status": "accessible",
          "product_scope": "PowerEdge R740xd",
          "publisher": "Dell Technologies",
          "revision": "Online technical-specification topic; topic revision not exposed",
          "source_id": "src.dell.r740xd.nic-ports",
          "title": "NIC ports",
          "url": "https://www.dell.com/support/manuals/en-us/poweredge-r740xd/per740xd_techspecs_pub/nic-ports?guid=guid-8ba21af1-af17-4133-85d8-442d2c1fe4f9&lang=en-us",
          "used_claim_ids": [
            "claim.r740xd.network-daughter-card"
          ]
        },
        {
          "access_status": "accessible",
          "product_scope": "PowerEdge R740xd, 14th-generation platform",
          "publisher": "Dell Technologies",
          "revision": "Online service-manual topic; topic revision not exposed",
          "source_id": "src.dell.r740xd.system-overview",
          "title": "PowerEdge R740xd system overview",
          "url": "https://www.dell.com/support/manuals/en-us/poweredge-r740xd/per740xd_ism_pub/poweredge-r740xd-system-overview?guid=guid-db2e151c-0b4d-4f95-8c09-d0d81a59807d&lang=en-us",
          "used_claim_ids": [
            "claim.r740xd.2u-dual-cpu-memory",
            "claim.r740xd.dual-psu"
          ]
        },
        {
          "access_status": "accessible",
          "product_scope": "Standards-defined UEFI boot-manager behavior",
          "publisher": "UEFI Forum",
          "revision": "2.10",
          "source_id": "src.uefi.2_10.boot-manager",
          "title": "UEFI Specification 2.10 — Boot Manager",
          "url": "https://uefi.org/specs/UEFI/2.10/03_Boot_Manager.html",
          "used_claim_ids": [
            "claim.uefi.os-loader-handoff"
          ]
        }
      ],
      "ticket_id": "ticket.generated.3ec80b1b0e7221ac725aedf9",
      "ticket_snapshot_digest": "1c74ad0725e500ac01d4c356f17551fee11678a88b35ca5b591ff056a2efdff2",
      "validation_trace": [
        {
          "code": "PUBLIC_INPUTS_ACCEPTED",
          "status": "PASS",
          "step": "request"
        },
        {
          "code": "EXACTLY_ONE_BINDING",
          "status": "PASS",
          "step": "binding_lookup"
        },
        {
          "code": "PUBLIC_SURFACE_AND_ACTIVE_CANDIDATES_ACCEPTED",
          "status": "PASS",
          "step": "public_surface"
        },
        {
          "code": "PROFILE_ID_REVISION_ACCEPTED",
          "status": "PASS",
          "step": "profile_pin"
        },
        {
          "code": "PUBLIC_CAPABILITY_TOPOLOGY_AND_CLOSURE_ACCEPTED",
          "status": "PASS",
          "step": "profile_consistency"
        },
        {
          "code": "PROFILE_DIGEST_ACCEPTED",
          "status": "PASS",
          "step": "serialization"
        },
        {
          "code": "ONE_SOURCE_PROJECTION_ACCEPTED",
          "status": "PASS",
          "step": "public_projection"
        }
      ]
    },
    {
      "authoring_validation_summary": {
        "coverage": {
          "authored_action_checks": 4,
          "authored_role_checks": 1,
          "differential_cases": 4
        },
        "gameplay_effect": "NONE",
        "public_projection_digest": "b92fef39ea570af34c979acfc383ef8c1961e51a9069eacb3faf0ba08172bc65",
        "reason_code": "AUTHORING_COMPATIBILITY_CONFIRMED",
        "status": "PASS",
        "validation_trace": [
          {
            "code": "SELECTED_PROFILE_MATCHES",
            "status": "PASS",
            "step": "profile_match"
          },
          {
            "code": "AUTHORING_REQUIREMENTS_ACCEPTED",
            "status": "PASS",
            "step": "compatibility"
          }
        ]
      },
      "binding_id": "binding.fingerprint.firmware.incompatible_version_set.system-model.v1",
      "case_id": "proof.case.binding.fingerprint.firmware.incompatible_version_set.system-model.v1",
      "differential_cases": 4,
      "fingerprint_id": "fingerprint.firmware.incompatible_version_set",
      "profile_id": "profile.dell.poweredge-r740xd.hybrid-24x2_5.v1",
      "profile_revision": 1,
      "public_candidate_combinations": 15,
      "public_candidate_count": 4,
      "public_projection_digest": "b92fef39ea570af34c979acfc383ef8c1961e51a9069eacb3faf0ba08172bc65",
      "public_projection_path": "docs/system-models/task-052/public-projections/binding-fingerprint-firmware-incompatible_version_set-system-model-v1.json",
      "rationale_graph_count": 41,
      "resolver_key": "resolver.fingerprint.firmware.incompatible_version_set.v1",
      "semantic_model_digest": "fdf7087d0896ab2dc7023f022d5273e2061e157ffe4d09d3ab64ea3a1a740f7b",
      "source_review": [
        {
          "access_status": "accessible",
          "product_scope": "iDRAC9 with Lifecycle Controller, including PowerEdge R740xd",
          "publisher": "Dell Technologies",
          "revision": "iDRAC9 6.xx Lifecycle Controller User's Guide",
          "source_id": "src.dell.idrac9.lifecycle-introduction",
          "title": "Lifecycle Controller introduction",
          "url": "https://www.dell.com/support/manuals/en-us/poweredge-r740xd/idrac9_6.xx_lc_ug/introduction",
          "used_claim_ids": [
            "claim.idrac9.out-of-band-management"
          ]
        },
        {
          "access_status": "accessible",
          "product_scope": "PowerEdge R740xd backplane options",
          "publisher": "Dell Technologies",
          "revision": "Online service-manual topic; topic revision not exposed",
          "source_id": "src.dell.r740xd.backplane-details",
          "title": "PowerEdge R740xd backplane details",
          "url": "https://www.dell.com/support/manuals/en-us/poweredge-r740xd/per740xd_ism_pub/backplane-details?guid=guid-5d119b25-5363-4be0-b451-e30ae7ca3f5b&lang=en-us",
          "used_claim_ids": [
            "claim.r740xd.hybrid-backplane",
            "claim.r740xd.twenty-sas-four-nvme-option"
          ]
        },
        {
          "access_status": "accessible",
          "product_scope": "PowerEdge R740xd 24-by-2.5-inch NVMe/hybrid routing",
          "publisher": "Dell Technologies",
          "revision": "Online service-manual topic; Figure 16; topic revision not exposed",
          "source_id": "src.dell.r740xd.cable-routing",
          "title": "PowerEdge R740xd cable routing",